<?xml version="1.0" encoding="UTF-8" standalone="no"?>
<childrenDB xmlns:xsi="http://www.w3.org/2001/XMLSchema-instance" xsi:noNamespaceSchemaLocation="childrenDB.xsd">
  <children>
    <child>
      <childId>1</childId>
      <childName>Kyle</childName>
      <age>2</age>
      <motherRefId>201</motherRefId>
      <motherRefName>Anne</motherRefName>
      <fatherRefId>202</fatherRefId>
      <fatherRefName>Paul</fatherRefName>
    </child>
    <child>
      <childId>2</childId>
      <childName>Maya</childName>
      <age>4</age>
      <motherRefId>203</motherRefId>
      <motherRefName>Jill</motherRefName>
      <fatherRefId>204</fatherRefId>
      <fatherRefName>Mike</fatherRefName>
    </child>
    <child>
      <childId>3</childId>
      <childName>Eric</childName>
      <age>5</age>
      <motherRefId>205</motherRefId>
      <motherRefName>Sue</motherRefName>
      <fatherRefId>206</fatherRefId>
      <fatherRefName>Joe</fatherRefName>
    </child>
    <child>
      <childId>4</childId>
      <childName>Carmen</childName>
      <age>10</age>
      <motherRefId>205</motherRefId>
      <motherRefName>Sue</motherRefName>
      <fatherRefId>206</fatherRefId>
      <fatherRefName>Joe</fatherRefName>
    </child>
    <child>
      <childId>9</childId>
      <childName>Ben</childName>
      <age>6</age>
      <motherRefId>NULL</motherRefId>
      <motherRefName>NULL</motherRefName>
      <fatherRefId>NULL</fatherRefId>
      <fatherRefName>NULL</fatherRefName>
    </child>
  </children>
  <parents>
    <parent>
      <parentId>201</parentId>
      <parentName>Anne</parentName>
      <affiliation>Safeway</affiliation>
      <salary>50000</salary>
    </parent>
    <parent>
      <parentId>202</parentId>
      <parentName>Paul</parentName>
      <affiliation>IBM</affiliation>
      <salary>60000</salary>
    </parent>
    <parent>
      <parentId>203</parentId>
      <parentName>Jill</parentName>
      <affiliation>Xerox</affiliation>
      <salary>65000</salary>
    </parent>
    <parent>
      <parentId>204</parentId>
      <parentName>Mike</parentName>
      <affiliation>NASA</affiliation>
      <salary>45000</salary>
    </parent>
    <parent>
      <parentId>205</parentId>
      <parentName>Sue</parentName>
      <affiliation>MGM</affiliation>
      <salary>56000</salary>
    </parent>
    <parent>
      <parentId>206</parentId>
      <parentName>Joe</parentName>
      <affiliation>Cisco</affiliation>
      <salary>67000</salary>
    </parent>
  </parents>
  <xmasBoxes>
    <xmasBox>
      <toy>PlayStation</toy>
      <giveRef>1</giveRef>
      <receiveRef>3</receiveRef>
    </xmasBox>
    <xmasBox>
      <toy>Gift card</toy>
      <giveRef>2</giveRef>
      <receiveRef>4</receiveRef>
    </xmasBox>
    <xmasBox>
      <toy>Pencils</toy>
      <giveRef>3</giveRef>
      <receiveRef>2</receiveRef>
    </xmasBox>
    <xmasBox>
      <toy>Puppet</toy>
      <giveRef>4</giveRef>
      <receiveRef>9</receiveRef>
    </xmasBox>
  </xmasBoxes>
  <phoneNumbers>
    <phoneNumber>
      <type>Home</type>
      <number>201-0001</number>
      <parentRefId>201</parentRefId>
    </phoneNumber>
    <phoneNumber>
      <type>Work</type>
      <number>202-0001</number>
      <parentRefId>202</parentRefId>
    </phoneNumber>
    <phoneNumber>
      <type>Cell</type>
      <number>202-0002</number>
      <parentRefId>202</parentRefId>
    </phoneNumber>
    <phoneNumber>
      <type>Home</type>
      <number>203-0001</number>
      <parentRefId>203</parentRefId>
    </phoneNumber>
    <phoneNumber>
      <type>Cell</type>
      <number>203-0002</number>
      <parentRefId>203</parentRefId>
    </phoneNumber>
    <phoneNumber>
      <type>Work</type>
      <number>204-0001</number>
      <parentRefId>204</parentRefId>
    </phoneNumber>
    <phoneNumber>
      <type>Work</type>
      <number>205-0001</number>
      <parentRefId>205</parentRefId>
    </phoneNumber>
    <phoneNumber>
      <type>Work</type>
      <number>206-0001</number>
      <parentRefId>206</parentRefId>
    </phoneNumber>
  </phoneNumbers>
  <SBPS>
    <schedule>
      <location>Location 2</location>
      <time>MonWed</time>
      <childRef>2</childRef>
    </schedule>
    <schedule>
      <location>Location 3</location>
      <time>MonTueWed</time>
      <childRef>3</childRef>
    </schedule>
    <schedule>
      <location>Location 4</location>
      <time>TueFri</time>
      <childRef>4</childRef>
    </schedule>
    <schedule>
      <location>Location 9</location>
      <time>MonWedSat</time>
      <childRef>9</childRef>
    </schedule>
  </SBPS>
</childrenDB>
